{
  "$schema": "http://json-schema.org/draft-07/schema#",
  "title": "EndpointPilot Drive Operations",
  "description": "Schema for EndpointPilot drive mapping operations",
  "type": "array",
  "items": {
    "type": "object",
    "properties": {
      "id": {
        "type": ["integer", "string"],
        "description": "Unique identifier for the drive operation"
      },
      "driveLetter": {
        "type": "string",
        "pattern": "^[A-Z]:$",
        "description": "Drive letter with colon"
      },
      "drivePath": {
        "type": "string",
        "pattern": "^\\\\\\\\.*",
        "description": "UNC path for the drive"
      },
      "reconnect": {
        "type": "boolean",
        "description": "Whether to reconnect the drive"
      },
      "delete": {
        "type": "boolean",
        "description": "Whether to delete the drive mapping"
      },
      "hidden": {
        "type": "boolean",
        "description": "Whether to hide the drive"
      },
      "targeting_type": {
        "type": "string",
        "enum": ["none", "group", "computer", "user"],
        "description": "Type of targeting to apply"
      },
      "target": {
        "type": "string",
        "description": "Target for the operation"
      },
      "_comment1": {
        "type": "string",
        "description": "Comment field 1"
      },
      "_comment2": {
        "type": "string",
        "description": "Comment field 2"
      }
    },
    "required": ["id", "driveLetter", "drivePath", "targeting_type", "target"],
    "additionalProperties": false
  }
}